{
  "$schema": "https://json-schema.org/draft/2020-12/schema",
  "$id": "https://learndoc.local/schemas/config.schema.json",
  "title": "learndoc.json",
  "type": "object",
  "additionalProperties": false,
  "required": [
    "schemaVersion",
    "language"
  ],
  "properties": {
    "schemaVersion": {
      "const": 1
    },
    "language": {
      "type": "string",
      "pattern": "^[a-z]{2,3}(-[A-Za-z0-9]{2,8})*$"
    },
    "audience": {
      "type": "string"
    },
    "references": {
      "type": "object",
      "propertyNames": {
        "$ref": "#/$defs/slug"
      },
      "additionalProperties": {
        "$ref": "#/$defs/reference"
      }
    },
    "features": {
      "type": "object",
      "additionalProperties": false,
      "properties": {
        "math": {
          "type": "boolean"
        }
      }
    },
    "boxTypes": {
      "type": "object",
      "propertyNames": {
        "$ref": "#/$defs/slug"
      },
      "additionalProperties": {
        "type": "object",
        "additionalProperties": false,
        "required": [
          "label"
        ],
        "properties": {
          "label": {
            "type": "string",
            "minLength": 1
          },
          "color": {
            "enum": [
              "c1",
              "c2",
              "c3",
              "c4",
              "c5",
              "c6"
            ]
          }
        }
      }
    },
    "editModel": {
      "type": "string",
      "pattern": "^[A-Za-z0-9][A-Za-z0-9._\\[\\]-]{0,63}$"
    },
    "edit": {
      "type": "object",
      "additionalProperties": false,
      "properties": {
        "maxRelated": {
          "type": "integer",
          "minimum": 1,
          "maximum": 30
        }
      }
    }
  },
  "$defs": {
    "slug": {
      "type": "string",
      "pattern": "^[a-z0-9][a-z0-9-]{0,63}$"
    },
    "reference": {
      "type": "object",
      "additionalProperties": false,
      "required": [
        "type",
        "file"
      ],
      "properties": {
        "type": {
          "enum": [
            "pdf",
            "markdown",
            "web"
          ]
        },
        "file": {
          "type": "string",
          "minLength": 1
        },
        "title": {
          "type": "string"
        },
        "url": {
          "$ref": "#/$defs/url"
        },
        "fetchedAt": {
          "type": "string",
          "pattern": "^[0-9]{4}-[0-9]{2}-[0-9]{2}$"
        }
      },
      "if": {
        "properties": {
          "type": {
            "const": "web"
          }
        }
      },
      "then": {
        "properties": {
          "url": {
            "$ref": "#/$defs/url"
          }
        },
        "required": [
          "url"
        ]
      }
    },
    "url": {
      "type": "string",
      "pattern": "^https?://"
    }
  }
}
